{
  "schema": "../contracts/constitutional-boundary.schema.json",
  "registry_id": "FORGE_CONSTITUTIONAL_BOUNDARIES_001",
  "source_documents": [
    "governance/constitution/CONSTITUTION_UNIFIED.md",
    "AGENTS.md",
    "governance/FORGE_GOVERNANCE_REGISTRY.md",
    "docs/00-governance/FORGE_ROBOCOP_DIRECTIVES.md",
    "adr/"
  ],
  "boundaries": [
    {
      "id": "BOUND-HUMAN-JUDGMENT",
      "source": "Unified Constitution",
      "path": "governance/constitution/CONSTITUTION_UNIFIED.md",
      "section": "Article 0 / Article VI",
      "description": "Forge may advise, explain and structure decisions, but the human remains final authority.",
      "scope": ["decision", "ai", "manager", "advisor"],
      "permitted_operations": ["recommend", "explain", "request approval", "record evidence"],
      "prohibited_operations": ["make final human decisions", "apply irreversible effects", "hide uncertainty"],
      "affected_components": ["Decision Core", "AI Connector", "Manager Intelligence"],
      "severity": "CRITICAL",
      "validation_method": "Stage manifests must block final authority transfer to generated code."
    },
    {
      "id": "BOUND-EVIDENCE-OWNERSHIP",
      "source": "Unified Constitution",
      "path": "governance/constitution/CONSTITUTION_UNIFIED.md",
      "section": "Article III / Article V",
      "description": "Every decision output must expose evidence, source, confidence and accountable owner.",
      "scope": ["decision", "truth", "evidence"],
      "permitted_operations": ["consume evidence", "link evidence", "state confidence"],
      "prohibited_operations": ["emit unsupported recommendations", "invent source truth"],
      "affected_components": ["Decision Core", "Traceability", "Evidence Contracts"],
      "severity": "CRITICAL",
      "validation_method": "Traceability and stage validators require evidence fields for READY stages."
    },
    {
      "id": "BOUND-UNKNOWN-REMAINS-UNKNOWN",
      "source": "AGENTS.md",
      "path": "AGENTS.md",
      "section": "Prime Directives",
      "description": "Unknown values must remain unknown and cannot be filled by plausible guesses.",
      "scope": ["product", "policy", "economic", "forecast"],
      "permitted_operations": ["mark unknown", "block stage", "request owner decision"],
      "prohibited_operations": ["infer unsupported values", "invent product data", "invent financial values"],
      "affected_components": ["Product Intelligence", "Compensation", "Quote Preview"],
      "severity": "CRITICAL",
      "validation_method": "Capability entries with insufficient evidence must be blocked."
    },
    {
      "id": "BOUND-ONE-METRIC-ONE-OWNER",
      "source": "AGENTS.md",
      "path": "AGENTS.md",
      "section": "Metric Ownership Rule",
      "description": "A metric has one conceptual owner; other domains consume official outputs.",
      "scope": ["metrics", "truth", "domains"],
      "permitted_operations": ["consume owner output", "reference owner", "validate owner"],
      "prohibited_operations": ["recalculate owned metrics", "create duplicate truth"],
      "affected_components": ["Truth Layer", "Domain Scaffolds"],
      "severity": "HIGH",
      "validation_method": "Scaffold contracts require declared metric owners."
    },
    {
      "id": "BOUND-AI-EXPLAINS-FORGE-DECIDES",
      "source": "AGENTS.md",
      "path": "AGENTS.md",
      "section": "AI Layer Principle",
      "description": "Generative AI may draft or explain; Forge decision logic remains outside AI output.",
      "scope": ["ai", "conversation", "decision"],
      "permitted_operations": ["draft text", "explain approved recommendations"],
      "prohibited_operations": ["invent recommendations", "invent coverage", "invent products"],
      "affected_components": ["Nash", "AI Connector"],
      "severity": "CRITICAL",
      "validation_method": "Path and stage validators reject AI final-decision capabilities."
    },
    {
      "id": "BOUND-ORCHESTRATOR-NO-DUPLICATION",
      "source": "AGENTS.md",
      "path": "AGENTS.md",
      "section": "Orchestrator Rule",
      "description": "Orchestrators consume engines and do not duplicate domain logic.",
      "scope": ["architecture", "runtime"],
      "permitted_operations": ["compose engine outputs", "route decisions"],
      "prohibited_operations": ["duplicate engine rules", "own domain truth"],
      "affected_components": ["Orchestrators", "Engines"],
      "severity": "HIGH",
      "validation_method": "Scaffold templates separate domain contracts from orchestrator contracts."
    },
    {
      "id": "BOUND-RULE-PACK-SEPARATION",
      "source": "AGENTS.md",
      "path": "AGENTS.md",
      "section": "Universal Core / Rule Pack Boundary",
      "description": "Forge Core stays universal; carrier, channel and period logic belongs in Rule Packs.",
      "scope": ["core", "rules", "carrier"],
      "permitted_operations": ["define rule pack boundary", "consume rule snapshot"],
      "prohibited_operations": ["hardcode carrier logic in core", "mix period rules"],
      "affected_components": ["Forge Core", "Rule Packs", "Compensation"],
      "severity": "CRITICAL",
      "validation_method": "Stage contracts require allowed and prohibited dependencies."
    },
    {
      "id": "BOUND-FORECAST-NOT-FACT",
      "source": "AGENTS.md",
      "path": "AGENTS.md",
      "section": "Forecast Truth Boundary",
      "description": "Forecasts are suggestions, estimates or scenarios, not facts.",
      "scope": ["forecast", "economic", "qualification"],
      "permitted_operations": ["label scenarios", "show confidence", "retain source period"],
      "prohibited_operations": ["present forecast as paid income", "confirm projected qualification"],
      "affected_components": ["Forecast Intelligence", "Compensation"],
      "severity": "CRITICAL",
      "validation_method": "Economic and forecast stages remain blocked until evidence contracts exist."
    },
    {
      "id": "BOUND-ECONOMIC-EVIDENCE",
      "source": "AGENTS.md",
      "path": "AGENTS.md",
      "section": "Economic Evidence Rule",
      "description": "Economic outputs require evidence, rules, rule snapshot, period context and confidence.",
      "scope": ["economic", "compensation", "contest"],
      "permitted_operations": ["use approved rule snapshots", "emit confidence"],
      "prohibited_operations": ["show income without supporting facts", "mix incompatible periods"],
      "affected_components": ["Compensation", "Economic Motivation"],
      "severity": "CRITICAL",
      "validation_method": "Stage SG-005 is deferred until rule contracts are ratified."
    },
    {
      "id": "BOUND-PRODUCT-TRUTH",
      "source": "AGENTS.md",
      "path": "AGENTS.md",
      "section": "Product Intelligence",
      "description": "Product truth comes from documentation; benefits, premiums and products are never invented.",
      "scope": ["product", "quote"],
      "permitted_operations": ["read source documents", "mark missing data", "generate preview with caveats"],
      "prohibited_operations": ["invent values", "produce binding quotes", "hide missing documentation"],
      "affected_components": ["Product Intelligence", "Quote Preview"],
      "severity": "CRITICAL",
      "validation_method": "Product catalog scope remains owner-decision blocked."
    },
    {
      "id": "BOUND-POLICY-TRUTH",
      "source": "Architecture docs",
      "path": "docs/architecture",
      "section": "Policy and sales operations boundaries",
      "description": "Policy operational facts, quote previews and forecasts are separate truth classes.",
      "scope": ["policy", "quote", "sales operations"],
      "permitted_operations": ["record evidence-backed policy events", "reference source systems"],
      "prohibited_operations": ["treat quote preview as issued policy", "overwrite historical policy facts"],
      "affected_components": ["Policy Operations", "Quote Preview"],
      "severity": "HIGH",
      "validation_method": "Traceability requires policy-specific boundary references."
    },
    {
      "id": "BOUND-MANAGER-COACHING-ONLY",
      "source": "Unified Constitution",
      "path": "governance/constitution/CONSTITUTION_UNIFIED.md",
      "section": "Human dignity and manager boundaries",
      "description": "Manager intelligence supports coaching and development, not automated consequences.",
      "scope": ["manager", "team", "people"],
      "permitted_operations": ["surface coaching signals", "request manager review"],
      "prohibited_operations": ["automate sanctions", "rank human worth", "final hiring or firing decisions"],
      "affected_components": ["Manager Intelligence", "Recruitment"],
      "severity": "CRITICAL",
      "validation_method": "Stages with people-development capabilities are blocked until owner approval."
    },
    {
      "id": "BOUND-NO-HUMAN-CONSEQUENCE-AUTOMATION",
      "source": "Unified Constitution",
      "path": "governance/constitution/CONSTITUTION_UNIFIED.md",
      "section": "Article VI",
      "description": "Forge must not automate consequential decisions about people.",
      "scope": ["manager", "candidate", "advisor"],
      "permitted_operations": ["recommend coaching", "show risk with evidence"],
      "prohibited_operations": ["auto-promote", "auto-fire", "auto-reject candidates"],
      "affected_components": ["Recruitment", "Manager Intelligence", "Mick"],
      "severity": "CRITICAL",
      "validation_method": "Capability classifications require DEFER or blocked state for consequential workflows."
    },
    {
      "id": "BOUND-RELATIONSHIP-NON-MANIPULATION",
      "source": "Unified Constitution",
      "path": "governance/constitution/CONSTITUTION_UNIFIED.md",
      "section": "Article VI",
      "description": "Relationship intelligence may prioritize helpful contact but must not manipulate clients.",
      "scope": ["relationship", "messaging"],